{
  "schema_version": "1.0",
  "candidate": "Troy Hokanson",
  "employer": "National General, an Allstate company",
  "role": "Claims Adjuster Trainee - CST",
  "job_id": "R33584",
  "job_url": "https://www.allstate.jobs/job/23658670/claims-adjuster-trainee-cst/",
  "created_date": "2026-08-03",
  "applied_date": null,
  "status": "Drafting",
  "fit_score": 83,
  "priority": "Tier 1",
  "work_mode": "Remote",
  "signature_decision": "Typed name only",
  "notion": {
    "record_url": null,
    "record_complete": false
  },
  "google_drive": {
    "folder_url": "https://drive.google.com/drive/folders/1V5Ryd9zc5SW4SO1L5DhJfdsrX7T4qtea",
    "folder_path": "09_Applications/2026-08-03 National General Claims Adjuster Trainee CST",
    "upload_complete": false
  },
  "github": {
    "repository": "troyhokanson/tjh-resume-cover-cv",
    "package_path": "applications/2026-08-03_national_general_claims_adjuster_trainee_cst",
    "commit_sha": null
  },
  "artifacts": {
    "job_description": "job_description.md",
    "resume_md": "resume.md",
    "cover_letter_md": "cover_letter.md",
    "resume_docx": "Troy_Hokanson_National_General_Claims_Adjuster_Trainee_Resume.docx",
    "resume_pdf": "Troy_Hokanson_National_General_Claims_Adjuster_Trainee_Resume.pdf",
    "cover_letter_docx": "Troy_Hokanson_National_General_Claims_Adjuster_Trainee_Cover_Letter.docx",
    "cover_letter_pdf": "Troy_Hokanson_National_General_Claims_Adjuster_Trainee_Cover_Letter.pdf",
    "qa_report": "qa_report.md"
  },
  "automation": {
    "last_sync_at": null,
    "last_sync_status": "partial",
    "errors": [
      "Official Allstate job URL redirects to job-not-found; accepting application form not confirmed."
    ]
  }
}
